{
  "contract_id": "attack_no_shot_v1",
  "project": "ScoutPraia",
  "module": "Ataque sem Finalização",
  "version": "v1.0",
  "status": "aprovado_para_implementacao",
  "semantic_source": "Contrato_Operacional.md",
  "implementation_source": "SCOUT_DESIGN_TEMPLATE",
  "runtime_source": "scoutpraia/services/attack_no_shot_contract.py",
  "test_source": "tests/test_attack_no_shot_contract.py",
  "module_rule": {
    "include_only_when": [
      "offensive_possession_ends_without_shot",
      "offensive_possession_lost"
    ],
    "exclude_when": [
      "shot_attempt_exists",
      "goal_exists",
      "goalkeeper_save_exists",
      "shot_block_exists",
      "event_belongs_to_other_module"
    ],
    "forbidden_fields": ["finish_type_code", "goal_zone"],
    "derived_fields": {
      "result_possession_auto": "lost_possession_no_shot",
      "points": 0
    }
  },
  "controlled_values": {
    "technical_error_subtype": [
      "three_seconds",
      "steps_violation",
      "double_dribble",
      "pass_error",
      "reception_error",
      "pass_error_foot",
      "pass_error_sideline",
      "pass_error_endline",
      "ground_ball_lost",
      "ball_handling_error"
    ],
    "passive_play_subtype": [
      "passive_fifth_pass_no_shot",
      "passive_no_shot_after_clear_chance_return"
    ],
    "substitution_error_subtype": [
      "illegal_entry_before_exit",
      "illegal_entry_zone",
      "too_many_players",
      "illegal_goalkeeper_exchange",
      "substitution_violation_other"
    ]
  },
  "events": [
    {
      "code": "technical_error_unforced",
      "name_ui": "Erro Técnico Não Forçado",
      "category": "Ataque sem finalização",
      "definition": "Perda de posse ofensiva sem finalização causada por erro técnico próprio, sem pressão ou ação defensiva clara.",
      "include_when": ["perda sem arremesso por erro técnico próprio", "sem ação defensiva determinante"],
      "exclude_when": ["defesa força claramente o erro", "interceptação com controle", "falta de ataque", "invasão da área", "passivo", "erro regulamentar de substituição"],
      "decision_rule": "Se a perda é causada por falha técnica do ataque e não por ação defensiva clara, marcar technical_error_unforced.",
      "allowed_points": [0],
      "required_fields": ["athlete_id", "court_zone", "position_code", "technical_error_subtype"],
      "optional_fields": ["system_code"],
      "derived_fields": {"result_possession_auto": "lost_possession_no_shot", "points": 0},
      "forbidden_fields": ["finish_type_code", "goal_zone"],
      "blocking_rules": ["block_if technical_error_subtype is empty", "block_if finish_type_code exists", "block_if goal_zone exists", "block_if points != 0"],
      "ui_type": "botao_principal",
      "validation_source": "IHF_USO_DA_BOLA + DECISAO_OPERACIONAL",
      "status": "novo",
      "positive_example": "Atacante sem pressão defensiva clara erra passe simples, deixa a bola cair, comete 3 segundos, passos, dois dribles ou joga a bola diretamente para fora, encerrando a posse sem arremesso.",
      "negative_example": "Atacante erra o passe porque a defensora fechou claramente a linha, pressionou a portadora ou induziu a decisão apressada; neste caso usar technical_error_forced.",
      "common_error": "Marcar toda perda de passe como erro não forçado sem verificar se houve ação defensiva determinante.",
      "acceptance_tests": [{"id": "T01", "type": "PASS"}, {"id": "FAIL-TECH-001", "type": "FAIL"}]
    },
    {
      "code": "technical_error_forced",
      "name_ui": "Erro Técnico Forçado",
      "category": "Ataque sem finalização",
      "definition": "Perda de posse ofensiva sem finalização causada por erro técnico provocado por pressão, posicionamento, dissuasão ou ação defensiva clara.",
      "include_when": ["defesa fecha espaço", "defesa pressiona", "defesa antecipa linha de passe", "defesa força violação técnica"],
      "exclude_when": ["atacante erra sozinha", "defesa intercepta e controla diretamente a bola", "bloqueio de arremesso", "falta de ataque", "passivo", "erro regulamentar de substituição"],
      "decision_rule": "Se a defesa causa o erro sem necessariamente roubar a bola, marcar technical_error_forced. Se a defesa toma/intercepta e controla a bola, usar steal em outro módulo.",
      "allowed_points": [0],
      "required_fields": ["athlete_id", "court_zone", "position_code", "technical_error_subtype"],
      "optional_fields": ["system_code"],
      "derived_fields": {"result_possession_auto": "lost_possession_no_shot", "points": 0, "defense_forced_error": true},
      "forbidden_fields": ["finish_type_code", "goal_zone"],
      "blocking_rules": ["block_if technical_error_subtype is empty", "block_if finish_type_code exists", "block_if goal_zone exists", "block_if points != 0"],
      "ui_type": "botao_principal",
      "validation_source": "RAG_DEFESA_PRESSAO + DECISAO_OPERACIONAL",
      "status": "novo",
      "positive_example": "Defensora fecha espaço, pressiona a portadora, antecipa a linha de passe ou reduz as opções, levando a atacante a cometer passe errado, recepção difícil ou violação técnica sem roubo direto da bola.",
      "negative_example": "Atacante sem pressão defensiva clara erra sozinha um passe simples ou deixa a bola cair; neste caso usar technical_error_unforced.",
      "common_error": "Marcar como erro forçado apenas porque havia defensora próxima, sem evidência de que a ação defensiva causou a perda.",
      "acceptance_tests": [{"id": "T02", "type": "PASS"}]
    },
    {
      "code": "offensive_foul",
      "name_ui": "Falta de Ataque",
      "category": "Ataque sem finalização",
      "definition": "Infração ofensiva cometida por atacante com posse ou jogadora do ataque, indicada pela arbitragem, que encerra a posse sem finalização.",
      "include_when": ["árbitro marca falta contra o ataque", "atacante empurra", "atacante carrega", "bloqueio ofensivo irregular"],
      "exclude_when": ["erro de passe/recepção", "não há marcação arbitral", "invasão", "passivo", "erro de substituição"],
      "decision_rule": "Se a posse termina por infração ofensiva de contato/posição, marcar offensive_foul. Se termina por violação técnica da bola, marcar erro técnico.",
      "allowed_points": [0],
      "required_fields": ["athlete_id", "court_zone", "position_code"],
      "optional_fields": ["system_code"],
      "derived_fields": {"result_possession_auto": "lost_possession_no_shot", "points": 0},
      "forbidden_fields": ["finish_type_code", "goal_zone"],
      "blocking_rules": ["block_if athlete_id/court_zone/position_code empty", "block_if finish_type_code exists", "block_if goal_zone exists", "block_if points != 0"],
      "ui_type": "botao_principal",
      "validation_source": "IHF_CONTATO_FALTA_ATAQUE + DECISAO_ARBITRAL",
      "status": "novo",
      "positive_example": "Árbitro marca falta contra o ataque após a atacante empurrar, carregar, usar o corpo/braço para abrir espaço ou colidir com defensora que ocupou legalmente a trajetória.",
      "negative_example": "Há contato corporal, mas não há marcação arbitral e a perda ocorre por passe errado, recepção falha, invasão, passivo ou erro de substituição.",
      "common_error": "Marcar falta de ataque apenas pela percepção do contato, sem decisão arbitral visível, audível ou suficientemente inferível no vídeo.",
      "acceptance_tests": [{"id": "T06", "type": "PASS"}]
    },
    {
      "code": "goal_area_invasion_attack",
      "name_ui": "Invasão da Área no Ataque",
      "category": "Ataque sem finalização",
      "definition": "Perda de posse ofensiva sem finalização por entrada da atacante na área da goleira com posse ou obtendo vantagem.",
      "include_when": ["atacante toca área com posse", "atacante pega bola na área", "atacante cai na área antes de soltar a bola"],
      "exclude_when": ["atacante entra após soltar a bola sem vantagem", "defensora invade", "finalização válida", "falta de ataque", "passivo", "erro de substituição"],
      "decision_rule": "Se a causa da perda é entrada ou uso ilegal da área pela atacante, marcar goal_area_invasion_attack. Não classificar invasão da área como erro forçado pela defesa.",
      "allowed_points": [0],
      "required_fields": ["athlete_id", "court_zone", "position_code"],
      "optional_fields": ["system_code"],
      "derived_fields": {"result_possession_auto": "lost_possession_no_shot", "points": 0},
      "forbidden_fields": ["finish_type_code", "goal_zone"],
      "blocking_rules": ["block_if athlete_id/court_zone/position_code empty", "block_if finish_type_code exists", "block_if goal_zone exists", "block_if points != 0"],
      "ui_type": "botao_principal",
      "validation_source": "IHF_AREA_GOLEIRA",
      "status": "novo",
      "positive_example": "Atacante pisa ou toca a área da goleira com posse, pega bola dentro da área, cai na área antes de soltar a bola ou obtém vantagem ofensiva entrando na área, encerrando a posse sem finalização válida.",
      "negative_example": "Atacante entra na área somente após soltar a bola, sem gerar vantagem, ou a finalização já havia sido válida antes da entrada.",
      "common_error": "Classificar invasão da área como erro técnico forçado pela defesa quando a causa regulamentar da perda foi a entrada ilegal na área.",
      "acceptance_tests": [{"id": "T05", "type": "PASS"}]
    },
    {
      "code": "passive_play_turnover",
      "name_ui": "Perda por Jogo Passivo",
      "category": "Ataque sem finalização",
      "definition": "Perda da posse ofensiva sem finalização por aplicação da regra de jogo passivo.",
      "include_when": ["5º passe após sinalização de passivo sem arremesso", "devolução após chance clara de gol seguida de passe em vez de arremesso"],
      "exclude_when": ["advertência de passivo sem perda", "ataque lento sem perda", "erro técnico comum", "falta de ataque", "invasão", "substituição irregular", "finalização executada"],